{
  "schema_version": "1.0",
  "proposal_id": "66666666-6666-4666-8666-666666666666",
  "tenant_id": "11111111-1111-4111-8111-111111111111",
  "world_id": "test-demo-001",
  "mode": "test",
  "extraction_ref": "nl:Extraction/demo-001",
  "source_content_hash": "bbbbbbbbbbbbbbbbbbbbbbbbbbbbbbbbbbbbbbbbbbbbbbbbbbbbbbbbbbbbbbbb",
  "extractor_version": "extractor-v1",
  "ontology_schema_revision": "schema-001",
  "business_intent_ref": "nl:BusinessIntent/demo-intent-001",
  "risk_class": "low",
  "rationale_summary": "Consumer explicitly declined promotional contact in demo message; synthetic test data.",
  "epistemic_kind": "preference",
  "operations": [
    {
      "op": "set_property",
      "target_ref": "eios:Consumer/22222222-2222-4222-8222-222222222222",
      "expected_revision": 3,
      "property_name": "promotional_contact_allowed",
      "value": false,
      "valid_from": "2026-10-07T08:00:00Z",
      "valid_to": "2026-10-21T08:00:00Z",
      "evidence_refs": [
        "nl:Message/demo-001"
      ]
    }
  ],
  "conflict_policy": "reject_and_reassess",
  "created_at": "2026-10-07T08:00:00Z"
}
